{
  "source_channel": "web",
  "citizen_name": "Juan Pérez",
  "is_anonymous": false,
  "document_id": "123456789",
  "email": "juan@email.com",
  "phone": "3001234567",
  "subject": "Hueco en la vía",
  "description": "En la comuna 11 hay un hueco grande que está causando accidentes.",
  "raw_text": "En la comuna 11 hay un hueco grande que está causando accidentes.",
  "attachments": [],
  "location_text": "Comuna 11, Medellín",
  "consent_data": true,
  "created_at": "2026-04-18T20:00:00Z"
}
